{
  "$schema": "https://json-schema.org/draft/2020-12/schema",
  "$id": "https://github.com/riversxiao/wordfilm/tools/deepseek-controller/plan.schema.json",
  "title": "WordFilm film plan (content only)",
  "description": "Strict JSON plan for Flash. No JS, shaders, expressions, or arbitrary paths. Validated in code by validate.py (jsonschema optional).",
  "type": "object",
  "additionalProperties": false,
  "required": ["topic", "style", "language", "targetDurationSec", "shots"],
  "properties": {
    "schemaVersion": { "type": "integer", "const": 1 },
    "content_type": { "type": "string", "enum": ["market", "concept", "personal", "english"] },
    "pacing": { "type": "string", "enum": ["fast", "standard", "calm"] },
    "topic": { "type": "string", "minLength": 1, "maxLength": 120 },
    "style": {
      "type": "string",
      "enum": ["swiss-motion", "pictogram-motion", "caption-news"]
    },
    "language": { "type": "string", "enum": ["zh", "en", "zh-en"] },
    "targetDurationSec": { "type": "number", "minimum": 15, "maximum": 90 },
    "palette": {
      "type": "object",
      "additionalProperties": false,
      "properties": {
        "page": { "type": "string", "pattern": "^#[0-9A-Fa-f]{6}$" },
        "ink": { "type": "string", "pattern": "^#[0-9A-Fa-f]{6}$" },
        "signal": { "type": "string", "pattern": "^#[0-9A-Fa-f]{6}$" },
        "paper": { "type": "string", "pattern": "^#[0-9A-Fa-f]{6}$" },
        "accent": { "type": "string", "pattern": "^#[0-9A-Fa-f]{6}$" }
      }
    },
    "shots": {
      "type": "array",
      "minItems": 1,
      "maxItems": 40,
      "items": {
        "type": "object",
        "additionalProperties": false,
        "required": ["id", "role", "text", "motionPreset"],
        "properties": {
          "id": { "type": "string", "pattern": "^[a-zA-Z][a-zA-Z0-9_-]{0,31}$" },
          "role": {
            "type": "string",
            "enum": ["hook", "setup", "explain", "evidence", "contrast", "payoff", "chapter", "card", "end", "credits"]
          },
          "text": { "type": "string", "minLength": 1, "maxLength": 200 },
          "onScreenText": { "type": "string", "maxLength": 120 },
          "data": {
            "type": "object",
            "description": "Numeric/facts only; no code strings",
            "additionalProperties": {
              "oneOf": [
                { "type": "number" },
                { "type": "string", "maxLength": 80 },
                { "type": "boolean" },
                { "type": "array", "items": { "type": "number" }, "maxItems": 32 }
              ]
            }
          },
          "motionPreset": { "type": "string", "minLength": 1, "maxLength": 40 },
          "pose": { "type": "string", "minLength": 1, "maxLength": 40 },
          "beats": { "type": "number", "minimum": 1, "maximum": 64 },
          "allowDarkOpen": { "type": "boolean" },
          "onScreenTextEn": { "type": "string", "maxLength": 40, "pattern": "^[A-Za-z0-9 .·%&/,'+\\-]*$", "description": "Latin card title (pictogram EN line); default gloss table / zh" }
        }
      }
    },
    "voice": {
      "type": "object",
      "additionalProperties": false,
      "properties": {
        "provider": {
          "type": "string",
          "enum": ["none", "edge", "kokoro", "qwen3", "omnivoice", "stepaudio", "elevenlabs"]
        },
        "voiceId": { "type": "string", "maxLength": 64 },
        "lines": {
          "type": "array",
          "maxItems": 40,
          "items": {
            "type": "object",
            "additionalProperties": false,
            "required": ["id", "text"],
            "properties": {
              "id": { "type": "string", "pattern": "^[a-zA-Z][a-zA-Z0-9_-]{0,31}$" },
              "text": { "type": "string", "minLength": 1, "maxLength": 200 },
              "shotId": { "type": "string", "pattern": "^[a-zA-Z][a-zA-Z0-9_-]{0,31}$" },
              "role": { "type": "string", "description": "dialogue function → lines.json function", "enum": ["hook", "turn", "evidence", "payoff", "sting"] },
              "cap": { "type": "string", "maxLength": 200, "description": "keyword-marked text ({关键词}); text = spoken words" },
              "say": { "type": "string", "minLength": 1, "maxLength": 200, "description": "TTS-only pronunciation of text (e.g. VaR → V-A-R); captions/srt/ASR keep text" },
              "lang": { "type": "string", "enum": ["zh", "en", "mixed"], "description": "TTS language: zh = Mandarin (default for CJK), en = English line, mixed = Chinese with English words (ElevenLabs language_code)" }
            }
          }
        }
      }
    },
    "credits": {
      "type": "object",
      "additionalProperties": false,
      "properties": {
        "title": { "type": "string", "maxLength": 80 },
        "author": { "type": "string", "maxLength": 80 },
        "year": { "type": "string", "maxLength": 12 },
        "license": { "type": "string", "maxLength": 40 }
      }
    },
    "brand": {
      "type": "object",
      "additionalProperties": false,
      "description": "Per-term display strings (pictogram finance-v002 reads eyebrow/eyebrowTop/endTitle/endLine). keepCase: acronyms never uppercased (VaR, not VAR).",
      "properties": {
        "eyebrow": { "type": "string", "maxLength": 48 },
        "eyebrowTop": { "type": "string", "maxLength": 48 },
        "endTitle": { "type": "string", "maxLength": 48 },
        "endLine": { "type": "string", "maxLength": 48 },
        "titleEn": { "type": "string", "maxLength": 48 },
        "titleZh": { "type": "string", "maxLength": 48 },
        "sloganEn": { "type": "string", "maxLength": 48 },
        "sloganZh": { "type": "string", "maxLength": 48 },
        "sloganJp": { "type": "string", "maxLength": 48 },
        "credit": { "type": "string", "maxLength": 48 },
        "keepCase": { "type": "array", "maxItems": 20, "items": { "type": "string", "minLength": 1, "maxLength": 16 } }
      }
    },
    "glossary": {
      "type": "object",
      "maxProperties": 20,
      "description": "term → 中文 gloss, added once in captions at the term's first appearance (ES → 预期尾部损失).",
      "additionalProperties": { "type": "string", "minLength": 1, "maxLength": 24 }
    }
  }
}
