{
  "schemaVersion": 1,
  "topic": "复利",
  "style": "pictogram-motion",
  "language": "zh",
  "targetDurationSec": 32,
  "palette": {
    "page": "#0B0B0B",
    "ink": "#F5F0E8",
    "signal": "#E30613",
    "accent": "#C9A227"
  },
  "shots": [
    {
      "id": "p0",
      "role": "hook",
      "text": "复利",
      "onScreenText": "复利",
      "motionPreset": "intro",
      "beats": 4
    },
    {
      "id": "p1",
      "role": "chapter",
      "text": "本金",
      "onScreenText": "本金",
      "motionPreset": "chapter",
      "beats": 4
    },
    {
      "id": "p2",
      "role": "card",
      "text": "利息",
      "onScreenText": "利息",
      "motionPreset": "card",
      "pose": "sprint",
      "beats": 4
    },
    {
      "id": "p3",
      "role": "card",
      "text": "时间",
      "onScreenText": "时间",
      "motionPreset": "card",
      "pose": "walk",
      "beats": 4
    },
    {
      "id": "p4",
      "role": "card",
      "text": "留下",
      "onScreenText": "留下",
      "motionPreset": "card",
      "pose": "golf",
      "beats": 4
    },
    {
      "id": "p5",
      "role": "explain",
      "text": "中途取出，雪球就停了。",
      "onScreenText": "别取出",
      "motionPreset": "hard-cut",
      "pose": "fencing",
      "beats": 4
    },
    {
      "id": "p6",
      "role": "payoff",
      "text": "复利靠的是留下。",
      "onScreenText": "留下",
      "motionPreset": "finale",
      "pose": "relay",
      "beats": 8
    },
    {
      "id": "p7",
      "role": "end",
      "text": "复利",
      "onScreenText": "复利",
      "motionPreset": "finale",
      "beats": 4
    }
  ],
  "voice": {
    "provider": "edge",
    "voiceId": "zh-CN-YunxiNeural",
    "lines": [
      { "id": "L01", "text": "一块钱，放着不动会怎样？", "shotId": "p0" },
      { "id": "L02", "text": "每年多出利息，利息再生利息。", "shotId": "p1" },
      { "id": "L03", "text": "同样本金，时间越长差距越大。", "shotId": "p2" },
      { "id": "L04", "text": "中途取出，后面的雪球就停了。", "shotId": "p3" },
      { "id": "L05", "text": "复利靠的是留下，而不是赌一把。", "shotId": "p4" }
    ]
  },
  "credits": {
    "title": "复利",
    "author": "riversxiao",
    "year": "2026",
    "license": "CC BY 4.0"
  }
}
