{
  "schemaVersion": 1,
  "topic": "分散投资",
  "style": "caption-news",
  "language": "zh",
  "targetDurationSec": 30,
  "palette": {
    "page": "#0E0E0C",
    "ink": "#F7F5EF",
    "signal": "#FFC21A",
    "accent": "#FF4A3D"
  },
  "shots": [
    {
      "id": "c1",
      "role": "hook",
      "text": "分散投资，不是把鸡蛋随便一撒。",
      "onScreenText": "分散|{不是乱撒}",
      "motionPreset": "hook",
      "allowDarkOpen": true
    },
    {
      "id": "c2",
      "role": "explain",
      "text": "股票、债券、现金，涨跌不同步。",
      "onScreenText": "三类|{不同步}",
      "motionPreset": "compare"
    },
    {
      "id": "c3",
      "role": "evidence",
      "text": "单一押注，风险会堆在一起。",
      "onScreenText": "集中|{堆风险}",
      "motionPreset": "stress"
    },
    {
      "id": "c4",
      "role": "contrast",
      "text": "多一类资产，就少一次踩坑。",
      "onScreenText": "多一类|{少踩坑}",
      "motionPreset": "loss"
    },
    {
      "id": "c5",
      "role": "payoff",
      "text": "分散，靠的是留下余地，不是赌一把。",
      "onScreenText": "余地|{别赌}",
      "motionPreset": "stock"
    },
    {
      "id": "c6",
      "role": "end",
      "text": "分散投资",
      "onScreenText": "分散投资",
      "motionPreset": "end"
    }
  ],
  "voice": {
    "provider": "edge",
    "voiceId": "zh-CN-YunxiNeural",
    "lines": [
      { "id": "L01", "text": "分散投资，不是把鸡蛋随便一撒。", "shotId": "c1" },
      { "id": "L02", "text": "股票、债券、现金，涨跌不同步。", "shotId": "c2" },
      { "id": "L03", "text": "单一押注，风险会堆在一起。", "shotId": "c3" },
      { "id": "L04", "text": "多一类资产，就少一次踩坑。", "shotId": "c4" },
      { "id": "L05", "text": "分散，靠的是留下余地，不是赌一把。", "shotId": "c5" }
    ]
  },
  "credits": {
    "title": "分散投资",
    "author": "riversxiao",
    "year": "2026",
    "license": "CC BY 4.0"
  }
}
