{
  "schemaVersion": 1,
  "topic": "复利",
  "style": "caption-news",
  "language": "zh",
  "targetDurationSec": 30,
  "palette": {
    "page": "#0E0E0C",
    "ink": "#F7F5EF",
    "signal": "#FFC21A",
    "accent": "#FF4A3D"
  },
  "shots": [
    {
      "id": "c1",
      "role": "hook",
      "text": "一块钱，放着不动会怎样？",
      "onScreenText": "复利|{是什么}",
      "motionPreset": "hook",
      "allowDarkOpen": true
    },
    {
      "id": "c2",
      "role": "explain",
      "text": "每年多出利息，利息再生利息。",
      "onScreenText": "利息|{再生利息}",
      "motionPreset": "compare",
      "data": { "rate": 0.07 }
    },
    {
      "id": "c3",
      "role": "evidence",
      "text": "同样本金，时间越长差距越大。",
      "onScreenText": "时间|{拉开差距}",
      "motionPreset": "stress",
      "data": { "years": [1, 10, 30] }
    },
    {
      "id": "c4",
      "role": "contrast",
      "text": "中途取出，后面的雪球就停了。",
      "onScreenText": "取出|{雪球停}",
      "motionPreset": "loss"
    },
    {
      "id": "c5",
      "role": "payoff",
      "text": "复利靠的是留下，而不是赌一把。",
      "onScreenText": "留下|{别赌}",
      "motionPreset": "stock"
    },
    {
      "id": "c6",
      "role": "end",
      "text": "复利",
      "onScreenText": "复利",
      "motionPreset": "end"
    }
  ],
  "voice": {
    "provider": "edge",
    "voiceId": "zh-CN-YunxiNeural",
    "lines": [
      { "id": "L01", "text": "一块钱，放着不动会怎样？", "shotId": "c1" },
      { "id": "L02", "text": "每年多出利息，利息再生利息。", "shotId": "c2" },
      { "id": "L03", "text": "同样本金，时间越长差距越大。", "shotId": "c3" },
      { "id": "L04", "text": "中途取出，后面的雪球就停了。", "shotId": "c4" },
      { "id": "L05", "text": "复利靠的是留下，而不是赌一把。", "shotId": "c5" }
    ]
  },
  "credits": {
    "title": "复利",
    "author": "riversxiao",
    "year": "2026",
    "license": "CC BY 4.0"
  }
}
