{
  "schemaVersion": 1,
  "topic": "复利",
  "style": "caption-news",
  "language": "zh",
  "targetDurationSec": 30,
  "palette": {
    "page": "#0E0E0C",
    "ink": "#F7F5EF",
    "signal": "#FFC21A",
    "accent": "#FF4A3D"
  },
  "shots": [
    {
      "id": "c1",
      "role": "hook",
      "text": "一块钱存着不动，三十年后会变成多少？",
      "onScreenText": "复利|{是什么}",
      "motionPreset": "hook",
      "allowDarkOpen": true
    },
    {
      "id": "c2",
      "role": "explain",
      "text": "利息滚回本金，第二年连利息一起生利息。",
      "onScreenText": "利息|{再生利息}",
      "motionPreset": "compare",
      "data": {
        "rate": 0.07
      }
    },
    {
      "id": "c3",
      "role": "evidence",
      "text": "按年利率百分之七算，三十年后接近七块六。",
      "onScreenText": "三十年|{七倍多}",
      "motionPreset": "stress",
      "data": {
        "years": [
          1,
          10,
          30
        ]
      }
    },
    {
      "id": "c4",
      "role": "contrast",
      "text": "中途取出花掉，后面的雪球就滚不动了。",
      "onScreenText": "取出|{雪球停}",
      "motionPreset": "loss"
    },
    {
      "id": "c5",
      "role": "payoff",
      "text": "复利靠的不是押对一次，是时间不被打断。",
      "onScreenText": "留下|{别打断}",
      "motionPreset": "stock"
    },
    {
      "id": "c6",
      "role": "end",
      "text": "复利",
      "onScreenText": "复利",
      "motionPreset": "end"
    }
  ],
  "voice": {
    "provider": "edge",
    "voiceId": "zh-CN-YunxiNeural",
    "lines": [
      {
        "id": "L01",
        "text": "一块钱存着不动，三十年后会变成多少？",
        "shotId": "c1"
      },
      {
        "id": "L02",
        "text": "利息滚回本金，第二年连利息一起生利息。",
        "shotId": "c2"
      },
      {
        "id": "L03",
        "text": "按年利率百分之七算，三十年后接近七块六。",
        "shotId": "c3"
      },
      {
        "id": "L04",
        "text": "中途取出花掉，后面的雪球就滚不动了。",
        "shotId": "c4"
      },
      {
        "id": "L05",
        "text": "复利靠的不是押对一次，是时间不被打断。",
        "shotId": "c5"
      }
    ]
  },
  "credits": {
    "title": "复利",
    "author": "riversxiao",
    "year": "2026",
    "license": "CC BY 4.0"
  }
}
