{
  "schemaVersion": 1,
  "topic": "流动性",
  "style": "caption-news",
  "language": "zh",
  "targetDurationSec": 30,
  "palette": {
    "page": "#0E0E0C",
    "ink": "#F7F5EF",
    "signal": "#FFC21A",
    "accent": "#FF4A3D"
  },
  "shots": [
    {
      "id": "c1",
      "role": "hook",
      "text": "钱在账上，不等于随时能用。",
      "onScreenText": "流动性|{是什么}",
      "motionPreset": "hook",
      "allowDarkOpen": true
    },
    {
      "id": "c2",
      "role": "explain",
      "text": "现金最快，房产最慢。",
      "onScreenText": "现金|{快}|房产|{慢}",
      "motionPreset": "compare",
      "data": {
        "cashDays": 0,
        "houseDays": 90
      }
    },
    {
      "id": "c3",
      "role": "evidence",
      "text": "市场紧张时，先缺的是周转。",
      "onScreenText": "周转|{先断}",
      "motionPreset": "stress",
      "data": {
        "series": [
          12,
          18,
          27,
          41
        ]
      }
    },
    {
      "id": "c4",
      "role": "contrast",
      "text": "同一资产，不同时机流动性差很远。",
      "onScreenText": "时机|{改变价格}",
      "motionPreset": "loss"
    },
    {
      "id": "c5",
      "role": "payoff",
      "text": "留一点随时能用的钱，是保护自己。",
      "onScreenText": "留一点|{活钱}",
      "motionPreset": "stock"
    },
    {
      "id": "c6",
      "role": "end",
      "text": "流动性",
      "onScreenText": "流动性",
      "motionPreset": "end"
    }
  ],
  "voice": {
    "provider": "edge",
    "voiceId": "zh-CN-YunxiNeural",
    "lines": [
      {
        "id": "L01",
        "text": "钱在账上，不等于随时能用。",
        "shotId": "c1"
      },
      {
        "id": "L02",
        "text": "现金最快，房产最慢。",
        "shotId": "c2"
      },
      {
        "id": "L03",
        "text": "市场紧张时，先缺的是周转。",
        "shotId": "c3"
      },
      {
        "id": "L04",
        "text": "同一资产，不同时机流动性差很远。",
        "shotId": "c4"
      },
      {
        "id": "L05",
        "text": "留一点随时能用的钱，是保护自己。",
        "shotId": "c5"
      }
    ]
  },
  "credits": {
    "title": "流动性",
    "author": "riversxiao",
    "year": "2026",
    "license": "CC BY 4.0"
  }
}
